{
  "schemaVersion": 1,
  "schema": "axiom.production_language.readiness.v1",
  "umbrellaIssue": 1432,
  "rows": [
    {
      "id": "native_scalar_runtime",
      "track": "native foundation",
      "requirement": "Scalar control flow and calls execute in a direct-native binary without generated Rust.",
      "requiredForProduction": true,
      "targetTier": "runtime_complete",
      "currentTier": "runtime_complete",
      "status": "implemented",
      "governingIssue": 1124,
      "dependencies": [],
      "evidence": ["stage1/runtime-abi/direct-native-v0.json", "stage1/crates/axiomc/tests/cranelift_backend.rs"],
      "validatingCommand": "make stage1-direct-native-runtime-abi",
      "rustCaptureRisk": "medium",
      "agentInspectionImpact": "Preserve native scalar lowering and generated_rust-null artifact evidence."
    },
    {
      "id": "local_package_workspace",
      "track": "package foundation",
      "requirement": "Local packages, path dependencies, workspaces, and lockfile validation are executable.",
      "requiredForProduction": true,
      "targetTier": "runtime_complete",
      "currentTier": "runtime_complete",
      "status": "implemented",
      "governingIssue": 936,
      "dependencies": [],
      "evidence": ["docs/package.md", "stage1/examples/workspace/axiom.toml", "stage1/examples/workspace_only/axiom.toml"],
      "validatingCommand": "make stage1-conformance",
      "rustCaptureRisk": "medium",
      "agentInspectionImpact": "Package graph inspection must retain deterministic local identities and lock state."
    },
    {
      "id": "build_effect_purity",
      "track": "semantic truth",
      "requirement": "Compilation never executes runtime effects or freezes runtime inputs into replay binaries.",
      "requiredForProduction": true,
      "targetTier": "runtime_complete",
      "currentTier": "static_spike",
      "status": "blocked",
      "governingIssue": 1434,
      "blockerIssues": [1434],
      "dependencies": [],
      "evidence": ["stage1/crates/axiomc/src/cranelift_backend.rs", "stage1/crates/axiomc/src/cranelift_backend/evaluator.rs", "stage1/examples/proof_cli/axiom.toml"],
      "validatingCommand": "make stage1-direct-native-runtime-abi-test",
      "rustCaptureRisk": "high",
      "agentInspectionImpact": "Build JSON must expose lowering mode, runtime support, and fail-closed diagnostics."
    },
    {
      "id": "executable_mir",
      "track": "semantic truth",
      "requirement": "A backend-neutral executable MIR represents control, values, effects, ownership, and provenance and drives native lowering.",
      "requiredForProduction": true,
      "targetTier": "runtime_complete",
      "currentTier": "syntax_only",
      "status": "blocked",
      "governingIssue": 1436,
      "blockerIssues": [1436, 1437],
      "dependencies": [1434, 1437],
      "evidence": ["docs/compiler-mir-backend-packages.md", "stage1/crates/axiomc/src/mir.rs"],
      "validatingCommand": "make stage1-mir-backend-boundary",
      "rustCaptureRisk": "critical",
      "agentInspectionImpact": "Agents need deterministic MIR blocks, effects, ownership operations, spans, and semantic provenance."
    },
    {
      "id": "runtime_lifecycle",
      "track": "native values",
      "requirement": "Allocation, move, clone, borrow, drop, recursive cleanup, and resource handles have target-neutral runtime semantics.",
      "requiredForProduction": true,
      "targetTier": "runtime_complete",
      "currentTier": "syntax_only",
      "status": "blocked",
      "governingIssue": 1438,
      "blockerIssues": [1438],
      "dependencies": [1437],
      "evidence": ["docs/direct-native-runtime-abi-v0.md", "docs/rust-bootstrap-boundary.md"],
      "validatingCommand": "make stage1-direct-native-runtime-abi",
      "rustCaptureRisk": "critical",
      "agentInspectionImpact": "Inspection must expose allocation effects, ownership transfer, drops, and resource obligations."
    },
    {
      "id": "runtime_sized_collections",
      "track": "native values",
      "requirement": "Runtime-sized sequences allocate, grow, index, mutate, iterate, and clean up from runtime-origin data.",
      "requiredForProduction": true,
      "targetTier": "runtime_complete",
      "currentTier": "syntax_only",
      "status": "blocked",
      "governingIssue": 1425,
      "blockerIssues": [1425],
      "dependencies": [1434, 1437, 1438],
      "evidence": ["docs/self-hosting-language-readiness.json", "stage1/examples/stdlib_collections/axiom.toml"],
      "validatingCommand": "make self-hosting-language-readiness",
      "rustCaptureRisk": "high",
      "agentInspectionImpact": "Expose allocation, capacity, element ownership, bounds, origin, and cleanup."
    },
    {
      "id": "runtime_string_slice_abi",
      "track": "native values",
      "requirement": "Runtime-origin strings and slices cross calls, returns, aggregates, and mutable aliases correctly.",
      "requiredForProduction": true,
      "targetTier": "runtime_complete",
      "currentTier": "static_spike",
      "status": "partial",
      "governingIssue": 1426,
      "blockerIssues": [1426],
      "dependencies": [1434, 1437, 1438, 1425],
      "evidence": ["docs/self-hosting-language-readiness.json", "stage1/runtime-abi/direct-native-v0.json"],
      "validatingCommand": "make stage1-direct-native-runtime-abi && make self-hosting-language-readiness",
      "rustCaptureRisk": "high",
      "agentInspectionImpact": "Expose storage, origin, length/capacity, ownership, aliasing, call/return ABI, and cleanup."
    },
    {
      "id": "runtime_associative_collections",
      "track": "native values",
      "requirement": "Runtime maps and sets provide growable storage, explicit equality/hashing, deterministic iteration, mutation, collision bounds, and cleanup.",
      "requiredForProduction": true,
      "targetTier": "runtime_complete",
      "currentTier": "syntax_only",
      "status": "blocked",
      "governingIssue": 1476,
      "blockerIssues": [1476],
      "dependencies": [1434, 1437, 1438, 1425, 1440],
      "evidence": ["docs/stage1-stdlib-status.md", "stage1/crates/axiomc/src/hir/maps.rs"],
      "validatingCommand": "make stage1-conformance && make stage1-stdlib-test",
      "rustCaptureRisk": "high",
      "agentInspectionImpact": "Expose key/value types, equality/hash/order contracts, collisions, allocation, lifecycle, and limits."
    },
    {
      "id": "dynamic_aggregate_abi",
      "track": "native values",
      "requirement": "Dynamic non-Copy aggregates cross calls, returns, storage, mutation, and cleanup without static projection shortcuts.",
      "requiredForProduction": true,
      "targetTier": "runtime_complete",
      "currentTier": "static_spike",
      "status": "partial",
      "governingIssue": 1439,
      "blockerIssues": [1439],
      "dependencies": [1436, 1438, 1425, 1426],
      "evidence": ["docs/dynamic-aggregate-abi-v1.md", "stage1/compiler-contracts/snapshots/dynamic-aggregate-abi-v1.json", "stage1/runtime-abi/direct-native-v0.json", "stage1/conformance/pass/type_system_aggregates/axiom.toml"],
      "validatingCommand": "make stage1-dynamic-aggregate-abi-v1-test && make stage1-dynamic-aggregate-abi-v1 && make stage1-direct-native-runtime-abi && make stage1-conformance",
      "rustCaptureRisk": "high",
      "agentInspectionImpact": "Expose value layouts, lifecycle, argument/return lowering, and unsupported shapes."
    },
    {
      "id": "ownership_resource_analysis",
      "track": "native values",
      "requirement": "One MIR pass proves moves, borrows, reborrows, joins, drops, and resource cleanup.",
      "requiredForProduction": true,
      "targetTier": "runtime_complete",
      "currentTier": "syntax_only",
      "status": "partial",
      "governingIssue": 1440,
      "blockerIssues": [1440],
      "dependencies": [1437, 1438, 1439, 1425, 1426],
      "evidence": ["stage1/crates/axiomc/src/borrowck.rs", "stage1/conformance/README.md"],
      "validatingCommand": "make stage1-conformance",
      "rustCaptureRisk": "critical",
      "agentInspectionImpact": "Provide deterministic moves, loans, origins, joins, drops, and rejected paths."
    },
    {
      "id": "unicode_text",
      "track": "cli and worker runtime",
      "requirement": "Runtime text supports explicit UTF-8 validation, slicing, split, lines, scalar iteration, and conversion.",
      "requiredForProduction": true,
      "targetTier": "runtime_complete",
      "currentTier": "static_spike",
      "status": "partial",
      "governingIssue": 1441,
      "blockerIssues": [1441],
      "dependencies": [1425, 1426, 1438, 1434],
      "evidence": ["docs/self-hosting-language-gaps.md", "stage1/crates/axiomc/src/stdlib.rs"],
      "validatingCommand": "make stage1-conformance && make stage1-direct-native-example-smoke",
      "rustCaptureRisk": "medium",
      "agentInspectionImpact": "Distinguish byte/scalar operations, validity, runtime origin, and allocation."
    },
    {
      "id": "iteration_control",
      "track": "cli and worker runtime",
      "requirement": "A stable iteration protocol, for loops, break, and continue work over runtime collections and text.",
      "requiredForProduction": true,
      "targetTier": "runtime_complete",
      "currentTier": "syntax_only",
      "status": "blocked",
      "governingIssue": 1442,
      "blockerIssues": [1442],
      "dependencies": [1425, 1437, 1440, 1441, 1476],
      "evidence": ["docs/grammar.md", "docs/iteration-control-v1.md", "stage1/compiler-contracts/snapshots/iteration-control-v1.json", "stage1/conformance/fail/for_loop_requires_iteration_protocol/axiom.toml", "stage1/conformance/pass/runtime_loop_bodies/axiom.toml"],
      "validatingCommand": "make stage1-iteration-control-v1-test && make stage1-iteration-control-v1 && make stage1-diagnostics-syntax-boundary && make stage1-hir-boundary && make stage1-mir-backend-boundary && make stage1-conformance",